[
  {
    "id": "cve-mcp-server",
    "name": "CVE MCP Server",
    "description": "Production-grade MCP server providing 27 security intelligence tools across 21 APIs for vulnerability research, threat intel, and risk scoring.",
    "category": "mcp",
    "github": "https://github.com/mukul975/cve-mcp-server",
    "npm": null,
    "pip": "cve-mcp-server",
    "install": "pip install -e .",
    "site": "https://www.mahipal.engineer/CVE-MCP-Server/",
    "license": "Unknown",
    "tags": ["security", "cve", "vulnerability", "threat-intel", "mcp"],
    "supportedBy": ["claude-code", "opencode", "cursor"],
    "docPath": "/docs/Develop-Code/AI-Development/MCPs/cve-mcp-server"
  },
  {
    "id": "claude-code",
    "name": "Claude Code",
    "description": "Anthropic's agentic CLI terminal tool for AI-powered coding with skills, memory, and tool orchestration.",
    "category": "agents",
    "github": null,
    "npm": "@anthropic-ai/claude-code",
    "pip": null,
    "install": "npm install -g @anthropic-ai/claude-code",
    "site": "https://docs.anthropic.com/en/docs/claude-code",
    "license": "Proprietary",
    "tags": ["cli", "coding", "agentic", "anthropic"],
    "supportedBy": ["ecc", "omo", "skills-sh", "agency-agents"],
    "docPath": "/docs/Develop-Code/AI-Development/Skills-and-Agents/claude-code"
  },
  {
    "id": "opencode",
    "name": "OpenCode",
    "description": "Terminal-first, provider-agnostic AI coding agent supporting 75+ LLM providers with Ask, Edit, Safe, and Agent modes.",
    "category": "agents",
    "github": "https://github.com/sst/opencode",
    "npm": null,
    "pip": null,
    "install": "curl -fsSL https://opencode.ai/install | bash",
    "site": "https://opencode.ai",
    "license": "MIT",
    "tags": ["cli", "coding", "agentic", "multi-provider"],
    "supportedBy": ["ecc", "omo", "skills-sh"],
    "docPath": "/docs/Develop-Code/AI-Development/Skills-and-Agents/opencode"
  },
  {
    "id": "skills-sh",
    "name": "Skills.sh",
    "description": "Open-source decentralized registry for AI agent capabilities — a package manager for AI intelligence.",
    "category": "agents",
    "github": "https://github.com/sdelrio/skills",
    "npm": "skills.sh",
    "pip": null,
    "install": "npx skills add <owner/repo>",
    "site": "https://skills.sh",
    "license": "Unknown",
    "tags": ["skills", "registry", "package-manager", "multi-agent"],
    "supportedBy": ["claude-code", "opencode", "cursor", "copilot", "windsurf", "cline"],
    "docPath": "/docs/Develop-Code/AI-Development/Skills-and-Agents/skills-sh"
  },
  {
    "id": "oh-my-openagent",
    "name": "Oh My OpenAgent",
    "description": "Batteries-included agent harness with multi-model orchestration, 40+ lifecycle hooks, and 9 specialized agents.",
    "category": "agents",
    "github": "https://github.com/code-yeongyu/oh-my-openagent",
    "npm": "oh-my-openagent",
    "pip": null,
    "install": "bunx oh-my-openagent install",
    "site": "https://ohmyopenagent.com/docs",
    "license": "Unknown",
    "tags": ["harness", "orchestration", "hooks", "specialized-agents"],
    "supportedBy": ["claude-code", "opencode"],
    "docPath": "/docs/Develop-Code/AI-Development/Skills-and-Agents/oh-my-openagent"
  },
  {
    "id": "obsidian-skills",
    "name": "Obsidian Skills & LLM Wiki",
    "description": "Guide for using Obsidian as an AI-maintained knowledge base with Karpathy's LLM Wiki pattern.",
    "category": "agents",
    "github": "https://github.com/kepano/obsidian-skills",
    "npm": null,
    "pip": null,
    "install": "npx skills add git@github.com:kepano/obsidian-skills.git",
    "site": null,
    "license": "Unknown",
    "tags": ["obsidian", "knowledge-base", "memory", "wiki"],
    "supportedBy": ["claude-code"],
    "docPath": "/docs/Develop-Code/AI-Development/Skills-and-Agents/obsidian-skills-setup"
  },
  {
    "id": "everything-claude-code",
    "name": "Everything Claude Code (ECC)",
    "description": "Hackathon-winning harness-native operator system: 63 agents, 251 skills, cross-harness support with AgentShield security.",
    "category": "agents",
    "github": "https://github.com/affaan-m/ECC",
    "npm": "ecc-universal",
    "pip": null,
    "install": "npm install -g ecc-universal",
    "site": null,
    "license": "MIT",
    "tags": ["agents", "skills", "security", "cross-harness"],
    "supportedBy": ["claude-code", "opencode", "cursor", "copilot", "gemini"],
    "docPath": "/docs/Develop-Code/AI-Development/Skills-and-Agents/everything-claude-code"
  },
  {
    "id": "opensre",
    "name": "OpenSRE",
    "description": "Open-source framework for building AI SRE agents for production incident investigation with 60+ integrations.",
    "category": "agents",
    "github": "https://github.com/Tracer-Cloud/opensre",
    "npm": null,
    "pip": "opensre",
    "install": "curl -fsSL https://install.opensre.com | bash",
    "site": "https://www.opensre.com",
    "license": "Unknown",
    "tags": ["sre", "incident-response", "observability", "integrations"],
    "supportedBy": [],
    "docPath": "/docs/Develop-Code/AI-Development/Skills-and-Agents/opensre-agents"
  },
  {
    "id": "openfang",
    "name": "OpenFang",
    "description": "Production-grade Agent Operating System built in Rust for 24/7 autonomous operations with 7 hands, 16 security layers, 40 channel adapters.",
    "category": "agents",
    "github": "https://github.com/RightNow-AI/openfang",
    "npm": null,
    "pip": null,
    "install": "curl -fsSL https://openfang.sh/install | sh",
    "site": "https://openfang.sh",
    "license": "MIT",
    "tags": ["autonomous", "rust", "agent-os", "24-7", "security"],
    "supportedBy": [],
    "docPath": "/docs/Develop-Code/AI-Development/Skills-and-Agents/openfang"
  },
  {
    "id": "opensandbox",
    "name": "OpenSandbox",
    "description": "Secure execution environment by Alibaba for running untrusted AI agent code with Docker/K8s runtime and network isolation.",
    "category": "security",
    "github": "https://github.com/alibaba/OpenSandbox",
    "npm": null,
    "pip": null,
    "install": "curl -fsSL https://get.opensandbox.io | bash",
    "site": null,
    "license": "Apache-2.0",
    "tags": ["sandbox", "security", "isolation", "untrusted-code"],
    "supportedBy": ["openfang"],
    "docPath": "/docs/Develop-Code/AI-Development/Skills-and-Agents/opensandbox"
  },
  {
    "id": "cybersecurity-skills",
    "name": "Cybersecurity Skills",
    "description": "734+ structured cybersecurity skills across 29 domains following the agentskills.io standard, mapped to MITRE ATT&CK.",
    "category": "agents",
    "github": "https://github.com/mukul975/Anthropic-Cybersecurity-Skills",
    "npm": null,
    "pip": null,
    "install": "npx skills add mukul975/Anthropic-Cybersecurity-Skills",
    "site": "https://www.mahipal.engineer/Anthropic-Cybersecurity-Skills/",
    "license": "Apache-2.0",
    "tags": ["security", "skills", "mitre-attack", "29-domains"],
    "supportedBy": ["claude-code"],
    "docPath": "/docs/Develop-Code/AI-Development/Skills-and-Agents/cybersecurity-skills"
  },
  {
    "id": "html-anything",
    "name": "HTML Anything",
    "description": "Agentic HTML editor that converts data into ship-ready, design-grade HTML with 75 skills across 9 surface modes.",
    "category": "tools",
    "github": "https://github.com/nexu-io/html-anything",
    "npm": null,
    "pip": null,
    "install": null,
    "site": null,
    "license": "Unknown",
    "tags": ["html", "design", "generative-ui", "75-skills"],
    "supportedBy": ["claude-code", "opencode", "cursor", "copilot", "gemini"],
    "docPath": "/docs/Develop-Code/AI-Development/Skills-and-Agents/html-anything"
  },
  {
    "id": "agent-security",
    "name": "Agent Security Guide",
    "description": "Practical layered defense model (5 layers) for preventing AI agents from leaking secrets, with CVE analysis.",
    "category": "security",
    "github": null,
    "npm": null,
    "pip": null,
    "install": null,
    "site": null,
    "license": "N/A",
    "tags": ["security", "defense", "secrets", "cve"],
    "supportedBy": [],
    "docPath": "/docs/Develop-Code/AI-Development/Skills-and-Agents/agent-security"
  },
  {
    "id": "agency-agents",
    "name": "Agency Agents",
    "description": "Curated collection of AI agent personas: Frontend Developer, Backend Architect, Security Engineer, DevOps Automator, and more.",
    "category": "agents",
    "github": "https://github.com/msitarzewski/agency-agents",
    "npm": null,
    "pip": null,
    "install": "./scripts/install.sh",
    "site": null,
    "license": "MIT",
    "tags": ["personas", "roles", "multi-agent"],
    "supportedBy": ["claude-code", "opencode", "copilot", "gemini", "cursor"],
    "docPath": "/docs/Develop-Code/AI-Development/Skills-and-Agents/ai-agency"
  },
  {
    "id": "mac-code",
    "name": "Mac-Code",
    "description": "Open-source AI coding agent for macOS using SSD flash-paging and persistent KV cache for local LLM inference.",
    "category": "models",
    "github": "https://github.com/walter-grace/mac-code",
    "npm": null,
    "pip": null,
    "install": null,
    "site": null,
    "license": "Unknown",
    "tags": ["macos", "local", "llm", "inference", "flash-paging"],
    "supportedBy": [],
    "docPath": "/docs/Develop-Code/AI-Development/Models-LLMs/mac-code"
  },
  {
    "id": "qwen35-small",
    "name": "Qwen3.5 Small Series",
    "description": "Small language models (0.8B-9B) for edge and local deployment with native multimodal support.",
    "category": "models",
    "github": null,
    "npm": null,
    "pip": null,
    "install": null,
    "site": "https://huggingface.co/collections/Qwen/qwen35",
    "license": "Apache-2.0",
    "tags": ["small-model", "edge", "local", "multimodal"],
    "supportedBy": ["mac-code"],
    "docPath": "/docs/Develop-Code/AI-Development/Models-LLMs/Qwen3.5-Small-Series"
  },
  {
    "id": "glm5-kimi",